[
  {"id":"daily-first-blood","name":"First Blood","name_ja":"初陣","category":"daily","rarity":"common","description":"Earn any profit today.","condition":{"type":"daily_profit","min":1},"reward_ac":10},
  {"id":"daily-bread-winner","name":"Bread Winner","name_ja":"日銭稼ぎ","category":"daily","rarity":"common","description":"Earn 100+ AC profit in a single day.","condition":{"type":"daily_profit","min":100},"reward_ac":25},
  {"id":"daily-salary-man","name":"Salary Man","name_ja":"サラリーマン","category":"daily","rarity":"common","description":"Earn 500+ AC profit in a single day.","condition":{"type":"daily_profit","min":500},"reward_ac":50},
  {"id":"daily-day-trader","name":"Day Trader","name_ja":"デイトレーダー","category":"daily","rarity":"uncommon","description":"Earn 1,000+ AC profit in a single day.","condition":{"type":"daily_profit","min":1000},"reward_ac":100},
  {"id":"daily-whale-hunter","name":"Whale Hunter","name_ja":"鯨狩り","category":"daily","rarity":"rare","description":"Earn 5,000+ AC profit in a single day.","condition":{"type":"daily_profit","min":5000},"reward_ac":300},
  {"id":"daily-golden-day","name":"Golden Day","name_ja":"黄金の日","category":"daily","rarity":"epic","description":"Earn 10,000+ AC profit in a single day.","condition":{"type":"daily_profit","min":10000},"reward_ac":500},
  {"id":"daily-god-hand","name":"God Hand","name_ja":"神の手","category":"daily","rarity":"legendary","description":"Earn 50,000+ AC profit in a single day.","condition":{"type":"daily_profit","min":50000},"reward_ac":2000},
  {"id":"daily-grinder","name":"Grinder","name_ja":"研磨師","category":"daily","rarity":"common","description":"Execute 50+ trades in a single day.","condition":{"type":"daily_trades","min":50},"reward_ac":30},
  {"id":"daily-machine-gun","name":"Machine Gun","name_ja":"マシンガン","category":"daily","rarity":"uncommon","description":"Execute 200+ trades in a single day.","condition":{"type":"daily_trades","min":200},"reward_ac":75},
  {"id":"daily-sharpshooter","name":"Sharpshooter","name_ja":"狙撃手","category":"daily","rarity":"rare","description":"Achieve 80%+ win rate with 10+ trades today.","condition":{"type":"daily_win_rate","min":0.8,"min_trades":10},"reward_ac":200},
  {"id":"daily-untouchable","name":"Untouchable","name_ja":"無傷","category":"daily","rarity":"epic","description":"Achieve 95%+ win rate with 20+ trades today.","condition":{"type":"daily_win_rate","min":0.95,"min_trades":20},"reward_ac":500},
  {"id":"daily-iron-wall","name":"Iron Wall","name_ja":"鉄壁","category":"daily","rarity":"uncommon","description":"Keep max drawdown under 100 AC with 10+ trades today.","condition":{"type":"daily_max_drawdown","max":100,"min_trades":10},"reward_ac":100},
  {"id":"daily-diamond-hands","name":"Diamond Hands","name_ja":"ダイヤの手","category":"daily","rarity":"rare","description":"Keep max drawdown under 50 AC with 20+ trades today.","condition":{"type":"daily_max_drawdown","max":50,"min_trades":20},"reward_ac":250},
  {"id":"daily-perfect-day","name":"Perfect Day","name_ja":"完璧な日","category":"daily","rarity":"epic","description":"Land 3+ perfect trades in a single day.","condition":{"type":"daily_perfect_trades","min":3},"reward_ac":400},
  {"id":"daily-critical-explorer","name":"Critical Explorer","name_ja":"臨界探求者","category":"daily","rarity":"uncommon","description":"Reach S7 Critical stage today.","condition":{"type":"daily_stage_reached","stage":7},"reward_ac":100},
  {"id":"daily-finale-witness","name":"Finale Witness","name_ja":"終焉の証人","category":"daily","rarity":"rare","description":"Reach S8 Finale stage today.","condition":{"type":"daily_stage_reached","stage":8},"reward_ac":200},
  {"id":"daily-jackpot-hunter","name":"Jackpot Hunter","name_ja":"ジャックポットハンター","category":"daily","rarity":"rare","description":"Trigger 2+ jackpot events today.","condition":{"type":"daily_jackpots","min":2},"reward_ac":300},
  {"id":"daily-phoenix","name":"Phoenix","name_ja":"不死鳥","category":"daily","rarity":"uncommon","description":"Make 3+ comebacks from negative PnL today.","condition":{"type":"daily_comebacks","min":3},"reward_ac":150},
  {"id":"daily-marathon-runner","name":"Marathon Runner","name_ja":"マラソンランナー","category":"daily","rarity":"common","description":"Complete 10+ battles today.","condition":{"type":"daily_battles","min":10},"reward_ac":50},
  {"id":"daily-rekt","name":"REKT","name_ja":"全損","category":"daily","rarity":"common","description":"Lose 1,000+ AC in a single day. Wear it with pride.","condition":{"type":"daily_profit_negative","max":-1000},"reward_ac":10},

  {"id":"life-hundred-club","name":"Hundred Club","name_ja":"百人衆","category":"lifetime","rarity":"common","description":"Win 100 battles.","condition":{"type":"total_wins","min":100},"reward_ac":100},
  {"id":"life-thousand-victories","name":"Thousand Victories","name_ja":"千勝","category":"lifetime","rarity":"uncommon","description":"Win 1,000 battles.","condition":{"type":"total_wins","min":1000},"reward_ac":500},
  {"id":"life-ten-thousand-wars","name":"Ten Thousand Wars","name_ja":"万戦錬磨","category":"lifetime","rarity":"rare","description":"Complete 10,000 battles.","condition":{"type":"total_battles","min":10000},"reward_ac":1000},
  {"id":"life-millionaire","name":"Millionaire","name_ja":"百万長者","category":"lifetime","rarity":"rare","description":"Earn 1,000,000 total AC profit.","condition":{"type":"total_profit","min":1000000},"reward_ac":2000},
  {"id":"life-billionaire","name":"Billionaire","name_ja":"億万長者","category":"lifetime","rarity":"epic","description":"Earn 100,000,000 total AC profit.","condition":{"type":"total_profit","min":100000000},"reward_ac":10000},
  {"id":"life-trillionaire","name":"Trillionaire","name_ja":"兆持ち","category":"lifetime","rarity":"legendary","description":"Earn 1,000,000,000 total AC profit.","condition":{"type":"total_profit","min":1000000000},"reward_ac":50000},
  {"id":"life-ten-thousand-trades","name":"Trade Veteran","name_ja":"万取引","category":"lifetime","rarity":"uncommon","description":"Execute 10,000 lifetime trades.","condition":{"type":"total_trades","min":10000},"reward_ac":300},
  {"id":"life-hundred-thousand-trades","name":"Trade Master","name_ja":"取引達人","category":"lifetime","rarity":"rare","description":"Execute 100,000 lifetime trades.","condition":{"type":"total_trades","min":100000},"reward_ac":1500},
  {"id":"life-streak-5","name":"Hot Streak","name_ja":"連勝街道","category":"lifetime","rarity":"common","description":"Achieve a 5-win streak.","condition":{"type":"total_max_streak","min":5},"reward_ac":50},
  {"id":"life-streak-10","name":"Unstoppable","name_ja":"無双","category":"lifetime","rarity":"uncommon","description":"Achieve a 10-win streak.","condition":{"type":"total_max_streak","min":10},"reward_ac":200},
  {"id":"life-streak-20","name":"Invincible","name_ja":"不敗","category":"lifetime","rarity":"rare","description":"Achieve a 20-win streak.","condition":{"type":"total_max_streak","min":20},"reward_ac":500},
  {"id":"life-streak-50","name":"Legendary Streak","name_ja":"伝説の連勝","category":"lifetime","rarity":"legendary","description":"Achieve a 50-win streak.","condition":{"type":"total_max_streak","min":50},"reward_ac":5000},
  {"id":"life-jackpot-collector","name":"Jackpot Collector","name_ja":"ジャックポット収集家","category":"lifetime","rarity":"uncommon","description":"Trigger 10 lifetime jackpots.","condition":{"type":"total_jackpots","min":10},"reward_ac":200},
  {"id":"life-jackpot-magnet","name":"Jackpot Magnet","name_ja":"ジャックポット磁石","category":"lifetime","rarity":"rare","description":"Trigger 50 lifetime jackpots.","condition":{"type":"total_jackpots","min":50},"reward_ac":1000},
  {"id":"life-jackpot-god","name":"Jackpot God","name_ja":"ジャックポットの神","category":"lifetime","rarity":"legendary","description":"Trigger 200 lifetime jackpots.","condition":{"type":"total_jackpots","min":200},"reward_ac":5000},
  {"id":"life-perfect-collector","name":"Precision Artist","name_ja":"精密芸術家","category":"lifetime","rarity":"rare","description":"Execute 20 perfect trades.","condition":{"type":"total_perfect_trades","min":20},"reward_ac":800},
  {"id":"life-perfect-machine","name":"Perfect Machine","name_ja":"完璧な機械","category":"lifetime","rarity":"epic","description":"Execute 100 perfect trades.","condition":{"type":"total_perfect_trades","min":100},"reward_ac":3000},
  {"id":"life-roster-master","name":"Roster Master","name_ja":"全キャラ使い","category":"lifetime","rarity":"uncommon","description":"Win with 8+ different bots.","condition":{"type":"total_unique_bots","min":8},"reward_ac":200},
  {"id":"life-roster-legend","name":"Roster Legend","name_ja":"全キャラ制覇","category":"lifetime","rarity":"rare","description":"Win with all 12+ bots.","condition":{"type":"total_unique_bots","min":12},"reward_ac":500},
  {"id":"life-finale-veteran","name":"Finale Veteran","name_ja":"終焉の古強者","category":"lifetime","rarity":"rare","description":"Survive 50 S8 Finale battles.","condition":{"type":"total_s8_battles","min":50},"reward_ac":1000},
  {"id":"life-cockroach","name":"Cockroach","name_ja":"不死身","category":"lifetime","rarity":"epic","description":"Come back from negative PnL 100 times.","condition":{"type":"total_comebacks","min":100},"reward_ac":2000},

  {"id":"style-trend-rider","name":"Trend Rider","name_ja":"トレンド乗り","category":"style","rarity":"common","description":"Over 70% of trades follow the prevailing trend.","condition":{"type":"style_pattern","pattern":"momentum_dominant"},"reward_ac":50},
  {"id":"style-contrarian","name":"Contrarian","name_ja":"逆張り師","category":"style","rarity":"uncommon","description":"Over 70% of trades go against the prevailing trend.","condition":{"type":"style_pattern","pattern":"contrarian"},"reward_ac":75},
  {"id":"style-scalper","name":"Scalper","name_ja":"スキャルパー","category":"style","rarity":"common","description":"Average hold time under 3 ticks.","condition":{"type":"style_pattern","pattern":"scalper"},"reward_ac":50},